"Variable / Field Name","Form Name","Section Header","Field Type","Field Label","Choices, Calculations, OR Slider Labels","Field Note","Text Validation Type OR Show Slider Number","Text Validation Min","Text Validation Max",Identifier?,"Branching Logic (Show field only if...)","Required Field?","Custom Alignment","Question Number (surveys only)","Matrix Group Name","Matrix Ranking?","Field Annotation"
record_id,felan_sports_medicine_only_mystery_caller_data_ent,,text,"Record ID",,,,,,,,,,,,,
physician_name,felan_sports_medicine_only_mystery_caller_data_ent,,dropdown,"Physician Information (see subspecialty, physician name, telephone number, and insurance variable combination)

TEXT or e-mail Nick with questions: 972-971-9698
