contacted1,felan_sports_medicine_only_mystery_caller_data_ent,,radio,"Able to contact office on first call?","1, Yes | 0, No",,,,,,,y,,,,,
calldate1,felan_sports_medicine_only_mystery_caller_data_ent,,text,"Date and Time of FIRST Phone Call.  NB:  To call during business hours from 0800 to 1700 local time with exclusion of 1200 to 1300.  ",,,datetime_mdy,"2024-07-01 00:00",,y,,y,,,,,
contacted2,felan_sports_medicine_only_mystery_caller_data_ent,,radio,"Able to contact office on second call attempt?  Use this is unable to reach the office the first time.  ","1, Yes I reached the office on a second attempt with this insurance type. | 0, No I tried a second phone call to the office with this insurance type and there was no success. | 99, NA",,,,,,,y,,,,,
calldate2,felan_sports_medicine_only_mystery_caller_data_ent,,text,"Date and Time of SECOND phone call, to completed on the next business day.",,,datetime_mdy,"2024-07-01 00:00",,y,,,,,,,
centralnumber,felan_sports_medicine_only_mystery_caller_data_ent,,yesno,"Central number (e.g. appointment center)?",,,,,,,,y,,,,,
appdate,felan_sports_medicine_only_mystery_caller_data_ent,,text,"Appointment Date",,,date_mdy,2024-07-01,2025-12-31,y,,,,,,,
transfers,felan_sports_medicine_only_mystery_caller_data_ent,,dropdown,"Number of Transfers (phone call transferred from one person or answering service to the next)","1, No transfers | 2, One transfer | 3, Two transfers | 4, More than two transfers",,,,,,,y,,,,,
calltime,felan_sports_medicine_only_mystery_caller_data_ent,,text,"Call Time (in seconds, round to nearest whole second)",,,integer,0,1000,,,,,,,,
exclusions,felan_sports_medicine_only_mystery_caller_data_ent,,radio,"Reason for exclusions","0, Included where physician was able to be contacted | 1, Closed medical system (e.g. Kaiser or military hospital) | 2, Greater than 5 minutes on hold | 3, Number contacted did not correspond to expected office/specialty | 5, Phone not answered or busy signal on repeat calls | 6, Physician's personal phone | 7, Physician referral required before scheduling appointment | 8, Went to voicemail | 9, Not accepting new patients | 10, Must see midlevel before seeing physician",,,,,,,y,,,,,
medicaid_status,felan_sports_medicine_only_mystery_caller_data_ent,,radio,"Does the physician accept Medicaid?","1, Yes they accept Medicaid | 2, No they do NOT ACCEPT Medicaid | 3, NA as this was a Blue Cross/Blue Shield call.",,,,,,,y,,,,,
holdtime,felan_sports_medicine_only_mystery_caller_data_ent,,text,"Hold Time (in seconds, round to nearest whole second)",,,integer,0,1000,,,,,,,,
notes,felan_sports_medicine_only_mystery_caller_data_ent,,notes,"Notes:
If the phone number is incorrect please Google the correct phone number and put the correct phone number here.  
Call or Text Nick: 972-971-9698.  
Dr. Muffly Cell Phone: 720-810-9863

We are HAPPY to answer questions.  ",,,,,,,,,,,,,
initials,felan_sports_medicine_only_mystery_caller_data_ent,,text,"Name of person completing form.  THANK YOU!",,,alpha_only,,,,,y,,,,,
reminders,felan_sports_medicine_only_mystery_caller_data_ent,,text,"Calls where you are on hold for more than five minutes and calls when they do not answer need to be called back within 24 hours, please.  

If the office asks if you have had imaging then say yes that you will bring it on CD.  

If the office asks you which type of Medicaid you have please tell them the ""State Medicaid"".  

If the office asks you which type of Blue Cross/Blue Shield plan you have it is the ""PPO (Preferred Provider Organization)"".  ",,,,,,,,,,,,,
